{
  "schema_version": 1,
  "id": "test-host-20260915-plotbench-baseline",
  "title": "Plotbench baseline",
  "recorded_at": "2026-09-15T10:00:00+02:00",
  "input_sha256": "092b6c5fe457a50538f12defa6a27bbe9b2a686550495cb71787f7fae241e669",
  "host": {
    "id": "test-host",
    "label": "Test host",
    "cpu": "Test CPU",
    "gpu": "Test GPU",
    "memory_gib": 16,
    "os": "Test OS 1.0",
    "architecture": "arm64"
  },
  "notes": "Synthetic baseline campaign for the website tests: two frontends, seven sections, three 30 s repetitions, one failed run and one source-limited run. Native display at 120 Hz and 2x scaling.",
  "classification": "benchmark",
  "completion_status": "completed",
  "planned_runs": 42,
  "runs": [
    {
      "id": "run-0001",
      "scenario": "waveform",
      "frontend": "pyqtgraph",
      "backend": "rust",
      "mode": "stream",
      "repetition": 1,
      "status": "ok",
      "config": {
        "hz": 60,
        "points": 10000,
        "append_count": 1000,
        "width": 512,
        "height": 512,
        "waveform_mode": "replace",
        "image_mode": "scalar",
        "view": "waveform",
        "seed": 42,
        "waveform_plots": 1,
        "curves": 1,
        "image_plots": 1
      },
      "measurement_seconds": 30,
      "warmup_seconds": 5,
      "samples": 1800,
      "context": {
        "fingerprint": "e94156bf4f7b6bb5de4f96b9a7ad5237566e56090bf31c2a8ed2f3d581f41134",
        "source_hash": "2dc815a9cf7b6bf38c7bc32d97feec1ebfbba6745fba363ff4058e4db6c5a22b",
        "commit": "d7195664b6dbf691573403d42eb640e5e1a28aa2",
        "dirty": false,
        "renderer": "pyqtgraph PlotCurveItem/ImageItem on QGraphicsView (raster)",
        "measurement_stage": "setData/setImage on the Qt thread including QImage conversion; compositor/presentation excluded",
        "versions": {
          "numpy": "2.5.3",
          "pyqtgraph": "0.14.1",
          "pyside6": "6.11.2",
          "python": "3.13.15",
          "qt": "6.11.2"
        },
        "pixel_ratio": 2,
        "viewport_size": [
          1100,
          820
        ],
        "plot_viewports": {
          "waveform": [
            1949.5,
            722.6
          ],
          "image": null
        },
        "display_protocol": "native",
        "refresh_hz": 120,
        "headless": false
      },
      "metrics": {
        "submitted_hz": 60.0,
        "update_p50_ms": 2.1,
        "update_p95_ms": 3.4,
        "cpu_mean_percent": 28.0,
        "rss_peak_mib": 233.8,
        "gap_percent": 0,
        "source_hz": 60.0,
        "source_deadline_misses": 0,
        "source_mailbox_drops": 0
      }
    },
    {
      "id": "run-0002",
      "scenario": "waveform",
      "frontend": "pyqtgraph",
      "backend": "rust",
      "mode": "stream",
      "repetition": 2,
      "status": "ok",
      "config": {
        "hz": 60,
        "points": 10000,
        "append_count": 1000,
        "width": 512,
        "height": 512,
        "waveform_mode": "replace",
        "image_mode": "scalar",
        "view": "waveform",
        "seed": 42,
        "waveform_plots": 1,
        "curves": 1,
        "image_plots": 1
      },
      "measurement_seconds": 30,
      "warmup_seconds": 5,
      "samples": 1800,
      "context": {
        "fingerprint": "e94156bf4f7b6bb5de4f96b9a7ad5237566e56090bf31c2a8ed2f3d581f41134",
        "source_hash": "2dc815a9cf7b6bf38c7bc32d97feec1ebfbba6745fba363ff4058e4db6c5a22b",
        "commit": "d7195664b6dbf691573403d42eb640e5e1a28aa2",
        "dirty": false,
        "renderer": "pyqtgraph PlotCurveItem/ImageItem on QGraphicsView (raster)",
        "measurement_stage": "setData/setImage on the Qt thread including QImage conversion; compositor/presentation excluded",
        "versions": {
          "numpy": "2.5.3",
          "pyqtgraph": "0.14.1",
          "pyside6": "6.11.2",
          "python": "3.13.15",
          "qt": "6.11.2"
        },
        "pixel_ratio": 2,
        "viewport_size": [
          1100,
          820
        ],
        "plot_viewports": {
          "waveform": [
            1949.5,
            722.6
          ],
          "image": null
        },
        "display_protocol": "native",
        "refresh_hz": 120,
        "headless": false
      },
      "metrics": {
        "submitted_hz": 59.9,
        "update_p50_ms": 2.2,
        "update_p95_ms": 3.5,
        "cpu_mean_percent": 28.3,
        "rss_peak_mib": 234.3,
        "gap_percent": 0,
        "source_hz": 60.0,
        "source_deadline_misses": 0,
        "source_mailbox_drops": 0
      }
    },
    {
      "id": "run-0003",
      "scenario": "waveform",
      "frontend": "pyqtgraph",
      "backend": "rust",
      "mode": "stream",
      "repetition": 3,
      "status": "ok",
      "config": {
        "hz": 60,
        "points": 10000,
        "append_count": 1000,
        "width": 512,
        "height": 512,
        "waveform_mode": "replace",
        "image_mode": "scalar",
        "view": "waveform",
        "seed": 42,
        "waveform_plots": 1,
        "curves": 1,
        "image_plots": 1
      },
      "measurement_seconds": 30,
      "warmup_seconds": 5,
      "samples": 1800,
      "context": {
        "fingerprint": "e94156bf4f7b6bb5de4f96b9a7ad5237566e56090bf31c2a8ed2f3d581f41134",
        "source_hash": "2dc815a9cf7b6bf38c7bc32d97feec1ebfbba6745fba363ff4058e4db6c5a22b",
        "commit": "d7195664b6dbf691573403d42eb640e5e1a28aa2",
        "dirty": false,
        "renderer": "pyqtgraph PlotCurveItem/ImageItem on QGraphicsView (raster)",
        "measurement_stage": "setData/setImage on the Qt thread including QImage conversion; compositor/presentation excluded",
        "versions": {
          "numpy": "2.5.3",
          "pyqtgraph": "0.14.1",
          "pyside6": "6.11.2",
          "python": "3.13.15",
          "qt": "6.11.2"
        },
        "pixel_ratio": 2,
        "viewport_size": [
          1100,
          820
        ],
        "plot_viewports": {
          "waveform": [
            1949.5,
            722.6
          ],
          "image": null
        },
        "display_protocol": "native",
        "refresh_hz": 120,
        "headless": false
      },
      "metrics": {
        "submitted_hz": 60.0,
        "update_p50_ms": 2.3000000000000003,
        "update_p95_ms": 3.6,
        "cpu_mean_percent": 28.6,
        "rss_peak_mib": 234.8,
        "gap_percent": 0,
        "source_hz": 60.0,
        "source_deadline_misses": 0,
        "source_mailbox_drops": 0
      }
    },
    {
      "id": "run-0004",
      "scenario": "multi-curve",
      "frontend": "pyqtgraph",
      "backend": "rust",
      "mode": "stream",
      "repetition": 1,
      "status": "ok",
      "config": {
        "hz": 60,
        "points": 10000,
        "append_count": 1000,
        "width": 512,
        "height": 512,
        "waveform_mode": "replace",
        "image_mode": "scalar",
        "view": "waveform",
        "seed": 42,
        "waveform_plots": 1,
        "curves": 10,
        "image_plots": 1
      },
      "measurement_seconds": 30,
      "warmup_seconds": 5,
      "samples": 1800,
      "context": {
        "fingerprint": "e94156bf4f7b6bb5de4f96b9a7ad5237566e56090bf31c2a8ed2f3d581f41134",
        "source_hash": "2dc815a9cf7b6bf38c7bc32d97feec1ebfbba6745fba363ff4058e4db6c5a22b",
        "commit": "d7195664b6dbf691573403d42eb640e5e1a28aa2",
        "dirty": false,
        "renderer": "pyqtgraph PlotCurveItem/ImageItem on QGraphicsView (raster)",
        "measurement_stage": "setData/setImage on the Qt thread including QImage conversion; compositor/presentation excluded",
        "versions": {
          "numpy": "2.5.3",
          "pyqtgraph": "0.14.1",
          "pyside6": "6.11.2",
          "python": "3.13.15",
          "qt": "6.11.2"
        },
        "pixel_ratio": 2,
        "viewport_size": [
          1100,
          820
        ],
        "plot_viewports": {
          "waveform": [
            1949.5,
            722.6
          ],
          "image": null
        },
        "display_protocol": "native",
        "refresh_hz": 120,
        "headless": false
      },
      "metrics": {
        "submitted_hz": 59.8,
        "update_p50_ms": 4.8,
        "update_p95_ms": 6.9,
        "cpu_mean_percent": 40.5,
        "rss_peak_mib": 260.9,
        "gap_percent": 0,
        "source_hz": 60.0,
        "source_deadline_misses": 0,
        "source_mailbox_drops": 0
      }
    },
    {
      "id": "run-0005",
      "scenario": "multi-curve",
      "frontend": "pyqtgraph",
      "backend": "rust",
      "mode": "stream",
      "repetition": 2,
      "status": "ok",
      "config": {
        "hz": 60,
        "points": 10000,
        "append_count": 1000,
        "width": 512,
        "height": 512,
        "waveform_mode": "replace",
        "image_mode": "scalar",
        "view": "waveform",
        "seed": 42,
        "waveform_plots": 1,
        "curves": 10,
        "image_plots": 1
      },
      "measurement_seconds": 30,
      "warmup_seconds": 5,
      "samples": 1800,
      "context": {
        "fingerprint": "e94156bf4f7b6bb5de4f96b9a7ad5237566e56090bf31c2a8ed2f3d581f41134",
        "source_hash": "2dc815a9cf7b6bf38c7bc32d97feec1ebfbba6745fba363ff4058e4db6c5a22b",
        "commit": "d7195664b6dbf691573403d42eb640e5e1a28aa2",
        "dirty": false,
        "renderer": "pyqtgraph PlotCurveItem/ImageItem on QGraphicsView (raster)",
        "measurement_stage": "setData/setImage on the Qt thread including QImage conversion; compositor/presentation excluded",
        "versions": {
          "numpy": "2.5.3",
          "pyqtgraph": "0.14.1",
          "pyside6": "6.11.2",
          "python": "3.13.15",
          "qt": "6.11.2"
        },
        "pixel_ratio": 2,
        "viewport_size": [
          1100,
          820
        ],
        "plot_viewports": {
          "waveform": [
            1949.5,
            722.6
          ],
          "image": null
        },